{
  "version": 1,
  "metadata": {
    "name": "pathfinding-grid-basic-fixture"
  },
  "systems": [
    "core.loop",
    "input.keyboard"
  ],
  "entities": [
    {
      "id": "map.nav",
      "components": [
        {
          "kind": "tile.layer",
          "version": 1,
          "replicated": false,
          "fields": {
            "tileWidth": 8,
            "tileHeight": 8,
            "columns": 3,
            "rows": 2,
            "tiles": [
              [0, 1, 0],
              [0, 0, 0]
            ],
            "palette": {
              "0": {
                "kind": "empty"
              },
              "1": {
                "kind": "rect",
                "solid": true
              }
            }
          }
        }
      ]
    },
    {
      "id": "wall.block",
      "components": [
        {
          "kind": "transform",
          "version": 1,
          "replicated": false,
          "fields": {
            "x": 0,
            "y": 8
          }
        },
        {
          "kind": "collision.bounds",
          "version": 1,
          "replicated": false,
          "fields": {
            "width": 8,
            "height": 8,
            "solid": true
          }
        }
      ]
    },
    {
      "id": "ghost.trigger",
      "components": [
        {
          "kind": "transform",
          "version": 1,
          "replicated": false,
          "fields": {
            "x": 8,
            "y": 8
          }
        },
        {
          "kind": "collision.bounds",
          "version": 1,
          "replicated": false,
          "fields": {
            "width": 8,
            "height": 8,
            "solid": false
          }
        }
      ]
    }
  ],
  "assetRefs": []
}
