{
  "version": 1,
  "metadata": {
    "name": "audio-lite-empty-fixture"
  },
  "systems": ["core.loop"],
  "entities": [
    {
      "id": "player.hero",
      "components": [
        {
          "kind": "transform",
          "version": 1,
          "replicated": false,
          "fields": {
            "x": 0,
            "y": 0
          }
        }
      ]
    }
  ]
}
