{
  "version": 1,
  "metadata": {
    "name": "template-side-view-blocking-basic",
    "tags": ["template", "v1-small-2d", "side-view"]
  },
  "systems": ["core.loop", "input.keyboard"],
  "entities": [
    {
      "id": "camera.main",
      "name": "Camera",
      "components": [
        {
          "kind": "camera.viewport",
          "version": 1,
          "replicated": false,
          "fields": {
            "x": 0,
            "y": 0,
            "width": 44,
            "height": 28
          }
        }
      ]
    },
    {
      "id": "map.stage",
      "name": "Side View Tile Layer",
      "components": [
        {
          "kind": "tile.layer",
          "version": 1,
          "replicated": false,
          "fields": {
            "tileWidth": 4,
            "tileHeight": 4,
            "columns": 9,
            "rows": 6,
            "layer": -10,
            "tiles": [
              [0, 0, 0, 0, 0, 0, 0, 0, 0],
              [0, 0, 0, 0, 0, 0, 0, 0, 0],
              [0, 1, 1, 2, 0, 0, 0, 0, 0],
              [0, 0, 0, 0, 0, 2, 0, 0, 0],
              [0, 0, 0, 0, 0, 0, 0, 0, 0],
              [2, 2, 2, 2, 2, 2, 2, 2, 2]
            ],
            "palette": {
              "0": {
                "kind": "empty"
              },
              "1": {
                "kind": "rect"
              },
              "2": {
                "kind": "rect",
                "solid": true
              }
            }
          }
        }
      ]
    },
    {
      "id": "player.hero",
      "name": "Player",
      "components": [
        {
          "kind": "transform",
          "version": 1,
          "replicated": false,
          "fields": {
            "x": 4,
            "y": 8
          }
        },
        {
          "kind": "visual.sprite",
          "version": 1,
          "replicated": false,
          "fields": {
            "assetId": "player.hero.sprite",
            "width": 8,
            "height": 8,
            "layer": 5
          }
        },
        {
          "kind": "collision.bounds",
          "version": 1,
          "replicated": false,
          "fields": {
            "width": 8,
            "height": 8,
            "solid": true
          }
        }
      ]
    },
    {
      "id": "sign.exit",
      "name": "Exit Sign",
      "components": [
        {
          "kind": "transform",
          "version": 1,
          "replicated": false,
          "fields": {
            "x": 24,
            "y": 12
          }
        },
        {
          "kind": "visual.sprite",
          "version": 1,
          "replicated": false,
          "fields": {
            "assetId": "sign.exit.sprite",
            "width": 4,
            "height": 4,
            "layer": 4
          }
        },
        {
          "kind": "collision.bounds",
          "version": 1,
          "replicated": false,
          "fields": {
            "width": 4,
            "height": 4,
            "solid": false
          }
        }
      ]
    }
  ],
  "assetRefs": []
}
