{
  "version": 1,
  "metadata": {
    "name": "collision-overlap-fixture"
  },
  "systems": [
    "core.loop"
  ],
  "entities": [
    {
      "id": "player.hero",
      "name": "Player",
      "components": [
        {
          "kind": "transform",
          "version": 1,
          "replicated": false,
          "fields": {
            "x": 10,
            "y": 10
          }
        },
        {
          "kind": "collision.bounds",
          "version": 1,
          "replicated": false,
          "fields": {
            "width": 16,
            "height": 16
          }
        }
      ]
    },
    {
      "id": "wall.block",
      "name": "Wall",
      "components": [
        {
          "kind": "transform",
          "version": 1,
          "replicated": false,
          "fields": {
            "x": 20,
            "y": 18
          }
        },
        {
          "kind": "collision.bounds",
          "version": 1,
          "replicated": false,
          "fields": {
            "width": 16,
            "height": 16,
            "solid": true
          }
        }
      ]
    },
    {
      "id": "ghost.zone",
      "name": "Ghost Zone",
      "components": [
        {
          "kind": "transform",
          "version": 1,
          "replicated": false,
          "fields": {
            "x": 12,
            "y": 12
          }
        },
        {
          "kind": "collision.bounds",
          "version": 1,
          "replicated": false,
          "fields": {
            "width": 4,
            "height": 4,
            "solid": false
          }
        }
      ]
    }
  ]
}
