{
  "version": 1,
  "metadata": {
    "name": "sprite-animation-missing-visual-sprite-fixture"
  },
  "entities": [
    {
      "id": "player.hero",
      "components": [
        {
          "kind": "transform",
          "version": 1,
          "replicated": false,
          "fields": {
            "x": 0,
            "y": 0
          }
        },
        {
          "kind": "visual.sprite.animation",
          "version": 1,
          "replicated": false,
          "fields": {
            "animationId": "player.idle",
            "assetId": "player.missing",
            "frameWidth": 16,
            "frameHeight": 16,
            "frames": [
              {
                "x": 0,
                "y": 0
              }
            ],
            "fps": 8
          }
        }
      ]
    }
  ],
  "systems": [
    "core.loop"
  ]
}
