{
  "version": 1,
  "metadata": {
    "name": "camera-viewport-fixture"
  },
  "systems": [
    "core.loop"
  ],
  "assetRefs": [
    "images/player.png"
  ],
  "entities": [
    {
      "id": "map.ground",
      "components": [
        {
          "kind": "tile.layer",
          "version": 1,
          "replicated": false,
          "fields": {
            "tileWidth": 16,
            "tileHeight": 16,
            "columns": 2,
            "rows": 2,
            "layer": -10,
            "tiles": [
              [1, 1],
              [1, 0]
            ],
            "palette": {
              "0": {
                "kind": "empty"
              },
              "1": {
                "kind": "rect",
                "width": 16,
                "height": 16
              }
            }
          }
        }
      ]
    },
    {
      "id": "player.hero",
      "components": [
        {
          "kind": "transform",
          "version": 1,
          "replicated": false,
          "fields": {
            "position": {
              "x": 30,
              "y": 40
            }
          }
        },
        {
          "kind": "visual.sprite",
          "version": 1,
          "replicated": false,
          "fields": {
            "assetId": "player.sprite",
            "width": 20,
            "height": 24,
            "layer": 2
          }
        }
      ]
    },
    {
      "id": "camera.main",
      "components": [
        {
          "kind": "camera.viewport",
          "version": 1,
          "replicated": false,
          "fields": {
            "x": 8,
            "y": 4,
            "width": 160,
            "height": 90
          }
        }
      ]
    }
  ]
}
