{
  "version": 1,
  "metadata": {
    "name": "portable-empty-visual-fixture"
  },
  "systems": [
    "core.loop"
  ],
  "entities": [
    {
      "id": "probe.entity",
      "components": [
        {
          "kind": "velocity",
          "version": 1,
          "replicated": false,
          "fields": {
            "x": 1,
            "y": 2
          }
        }
      ]
    }
  ]
}
